<?xml version="1.0" encoding="UTF-8"?>
<xs:schema attributeFormDefault="unqualified" elementFormDefault="qualified" xmlns:xs="http://www.w3.org/2001/XMLSchema">
  <xs:element name="fsm" type="fsmType"/>
  <xs:complexType name="eventType">
    <xs:simpleContent>
      <xs:extension base="xs:string">
        <xs:attribute type="xs:string" name="name" use="required"/>
        <xs:attribute type="xs:string" name="handlerFunction" use="required"/>
        <xs:attribute type="xs:string" name="resultState" use="required"/>
      </xs:extension>
    </xs:simpleContent>
  </xs:complexType>
  <xs:complexType name="stateType">
    <xs:sequence>
      <xs:element type="eventType" name="event" maxOccurs="unbounded" minOccurs="1"/>
    </xs:sequence>
    <xs:attribute type="xs:string" name="name" use="required"/>
  </xs:complexType>
  <xs:complexType name="fsmType">
    <xs:sequence>
      <xs:element type="stateType" name="state" maxOccurs="unbounded" minOccurs="0"/>
    </xs:sequence>
    <xs:attribute type="xs:string" name="name" use="optional"/>
    <xs:attribute type="xs:string" name="author" use="optional"/>
    <xs:attribute type="xs:string" name="version" use="optional"/>
    <xs:attribute type="xs:string" name="implClass" use="required"/>
  </xs:complexType>
</xs:schema>